{
  "apiVersion": "survey.mission-kit/v1alpha1",
  "kind": "RoundInstrument",
  "metadata": {
    "name": "round-2-instrument"
  },
  "spec": {
    "roundRef": {
      "apiVersion": "survey.mission-kit/v1alpha1",
      "kind": "SurveyRound",
      "name": "round-2",
      "semanticDigest": "sha256:6666666666666666666666666666666666666666666666666666666666666666"
    },
    "roundOrdinal": 2,
    "frameSetRef": {
      "apiVersion": "survey.mission-kit/v1alpha1",
      "kind": "QuestionFrameSet",
      "name": "round-2-frame-set",
      "semanticDigest": "sha256:eeeeeeeeeeeeeeeeeeeeeeeeeeeeeeeeeeeeeeeeeeeeeeeeeeeeeeeeeeeeeeee"
    },
    "policySnapshotRef": {
      "apiVersion": "survey.mission-kit/v1alpha1",
      "kind": "SurveyPolicySnapshot",
      "name": "survey-policy",
      "semanticDigest": "sha256:8888888888888888888888888888888888888888888888888888888888888888"
    },
    "generationContextRef": {
      "apiVersion": "authoring.mission-kit/v1alpha1",
      "kind": "ContextClosure",
      "name": "survey-context",
      "semanticDigest": "sha256:9999999999999999999999999999999999999999999999999999999999999999"
    },
    "units": [
      {
        "slot": 1,
        "questionOrdinal": 4,
        "questionFrameRef": {
          "apiVersion": "schemas.mission-kit/v1alpha1",
          "kind": "ContextFrame",
          "name": "question-4-frame",
          "semanticDigest": "sha256:cccccccccccccccccccccccccccccccccccccccccccccccccccccccccccccccc"
        },
        "bindingRef": {
          "apiVersion": "survey.mission-kit/v1alpha1",
          "kind": "SurveyQuestionBinding",
          "name": "binding-4",
          "semanticDigest": "sha256:dddddddddddddddddddddddddddddddddddddddddddddddddddddddddddddddd"
        },
        "questionRef": {
          "apiVersion": "schemas.mission-kit/v1alpha1",
          "kind": "Question",
          "name": "question-4",
          "semanticDigest": "sha256:bbbbbbbbbbbbbbbbbbbbbbbbbbbbbbbbbbbbbbbbbbbbbbbbbbbbbbbbbbbbbbbb"
        }
      },
      {
        "slot": 2,
        "questionOrdinal": 5,
        "questionFrameRef": {
          "apiVersion": "schemas.mission-kit/v1alpha1",
          "kind": "ContextFrame",
          "name": "question-5-frame",
          "semanticDigest": "sha256:cccccccccccccccccccccccccccccccccccccccccccccccccccccccccccccccc"
        },
        "bindingRef": {
          "apiVersion": "survey.mission-kit/v1alpha1",
          "kind": "SurveyQuestionBinding",
          "name": "binding-5",
          "semanticDigest": "sha256:dddddddddddddddddddddddddddddddddddddddddddddddddddddddddddddddd"
        },
        "questionRef": {
          "apiVersion": "schemas.mission-kit/v1alpha1",
          "kind": "Question",
          "name": "question-5",
          "semanticDigest": "sha256:bbbbbbbbbbbbbbbbbbbbbbbbbbbbbbbbbbbbbbbbbbbbbbbbbbbbbbbbbbbbbbbb"
        }
      },
      {
        "slot": 3,
        "questionOrdinal": 6,
        "questionFrameRef": {
          "apiVersion": "schemas.mission-kit/v1alpha1",
          "kind": "ContextFrame",
          "name": "question-6-frame",
          "semanticDigest": "sha256:cccccccccccccccccccccccccccccccccccccccccccccccccccccccccccccccc"
        },
        "bindingRef": {
          "apiVersion": "survey.mission-kit/v1alpha1",
          "kind": "SurveyQuestionBinding",
          "name": "binding-6",
          "semanticDigest": "sha256:dddddddddddddddddddddddddddddddddddddddddddddddddddddddddddddddd"
        },
        "questionRef": {
          "apiVersion": "schemas.mission-kit/v1alpha1",
          "kind": "Question",
          "name": "question-6",
          "semanticDigest": "sha256:bbbbbbbbbbbbbbbbbbbbbbbbbbbbbbbbbbbbbbbbbbbbbbbbbbbbbbbbbbbbbbbb"
        }
      }
    ],
    "responsePolicy": {
      "capture": "option-id-list",
      "rawEvidence": "preserved",
      "duplicateSubmission": "idempotent",
      "invalidSelection": "reject-without-advance"
    }
  }
}
